{
  "$schema": "./registry.schema.json",
  "schema_version": "2.0",
  "contract_version": "2.0.0-preview.5",
  "status": "preview",
  "coverage": {
    "mode": "complete",
    "canonical_tool_count": 25,
    "target_canonical_tool_count": 25,
    "public_name_count": 26,
    "target_public_name_count": 26
  },
  "profiles": [
    "skill-only",
    "marketplace-lite",
    "full"
  ],
  "profile_aliases": {
    "marketplace-lite": [
      "lite",
      "marketplace_lite",
      "marketplace-lite-binary"
    ],
    "full": [
      "full_cli"
    ]
  },
  "side_effect_classes": [
    "read",
    "local-config-write",
    "local-reference-write",
    "project-write",
    "network",
    "loopback-listener",
    "process-launch",
    "agent-launch"
  ],
  "error_taxonomy": {
    "invalid_arguments": {
      "retryable": false,
      "redaction_required": true,
      "description": "The caller supplied missing, unknown, or type-invalid arguments."
    },
    "tool_error": {
      "retryable": false,
      "redaction_required": true,
      "description": "The tool could not complete a bounded local operation."
    },
    "timeout": {
      "retryable": true,
      "redaction_required": true,
      "description": "A bounded network or local operation exceeded its deadline."
    }
  },
  "tools": [
    {
      "name": "qiongli_literature_status",
      "description": "Report configured literature providers and capability mode without exposing secrets.",
      "aliases": [],
      "maturity": "stable",
      "lifecycle": {
        "introduced_in": "legacy",
        "deprecated_in": null,
        "remove_after": null
      },
      "profiles": {
        "skill-only": {
          "exposure": "metadata-only",
          "error_transport": "not-applicable"
        },
        "marketplace-lite": {
          "exposure": "tool",
          "input_schema_ref": "schemas/qiongli_literature_status.input.schema.json",
          "output_schema_ref": "schemas/qiongli_literature_status.output.schema.json",
          "error_transport": "json-rpc-and-tool-result"
        },
        "full": {
          "exposure": "tool",
          "input_schema_ref": "schemas/qiongli_literature_status.input.schema.json",
          "output_schema_ref": "schemas/qiongli_literature_status.output.schema.json",
          "error_transport": "tool-result"
        }
      },
      "errors": [
        "invalid_arguments",
        "tool_error"
      ],
      "side_effects": [
        {
          "class": "read",
          "mode": "always"
        }
      ],
      "security": {
        "accepts_secret_input": false,
        "raw_secret_output": "forbidden",
        "redaction_required": true,
        "sensitive_output_paths": [],
        "notes": [
          "Only provider readiness, active-provider identity, implemented capabilities, activation-field names, and redacted configuration state may be returned.",
          "Provider capability records share one schema, but each runtime profile must report only behavior it actually implements; Lite capability lists may be strict subsets of Full.",
          "Provider credentials, environment values, malformed configuration content, and local configuration paths must not appear in results or errors.",
          "Configured status is local readiness metadata, not a live provider health guarantee."
        ]
      },
      "smoke_call_ids": [
        "lite.qiongli_literature_status.contract",
        "full.qiongli_literature_status.contract"
      ]
    },
    {
      "name": "qiongli_search_plan",
      "description": "Plan provider and platform-native literature search routing without executing search.",
      "aliases": [],
      "maturity": "preview",
      "lifecycle": {
        "introduced_in": "legacy",
        "deprecated_in": null,
        "remove_after": null
      },
      "profiles": {
        "skill-only": {
          "exposure": "metadata-only",
          "error_transport": "not-applicable"
        },
        "marketplace-lite": {
          "exposure": "tool",
          "input_schema_ref": "schemas/qiongli_search_plan.input.schema.json",
          "output_schema_ref": "schemas/qiongli_search_plan.output.schema.json",
          "error_transport": "json-rpc-and-tool-result"
        },
        "full": {
          "exposure": "tool",
          "input_schema_ref": "schemas/qiongli_search_plan.input.schema.json",
          "output_schema_ref": "schemas/qiongli_search_plan.output.schema.json",
          "error_transport": "tool-result"
        }
      },
      "errors": [
        "invalid_arguments",
        "tool_error"
      ],
      "side_effects": [
        {
          "class": "read",
          "mode": "always"
        }
      ],
      "security": {
        "accepts_secret_input": false,
        "raw_secret_output": "forbidden",
        "redaction_required": true,
        "sensitive_output_paths": [
          "/query",
          "/provider_queries",
          "/native_search_queries",
          "/native_fulltext_queries"
        ],
        "notes": [
          "The tool plans routes only and must not execute provider, platform-native, process, or agent operations.",
          "Research queries and generated routes may be returned to the caller but must not be copied into shared logs automatically.",
          "During the v2 compatibility window, year filters emit canonical from_year/to_year together with deprecated fromYear/toYear aliases.",
          "Provider credentials, environment values, malformed configuration content, and local configuration paths must not appear in plans or errors."
        ]
      },
      "smoke_call_ids": [
        "lite.qiongli_search_plan.contract",
        "full.qiongli_search_plan.contract"
      ]
    },
    {
      "name": "qiongli_literature_search",
      "description": "Search academic literature using the providers available in the active Qiongli runtime profile.",
      "aliases": [],
      "maturity": "preview",
      "lifecycle": {
        "introduced_in": "legacy",
        "deprecated_in": null,
        "remove_after": null
      },
      "profiles": {
        "skill-only": {
          "exposure": "metadata-only",
          "error_transport": "not-applicable"
        },
        "marketplace-lite": {
          "exposure": "tool",
          "input_schema_ref": "schemas/qiongli_literature_search.marketplace-lite.input.schema.json",
          "output_schema_ref": "schemas/qiongli_literature_search.marketplace-lite.output.schema.json",
          "error_transport": "json-rpc-and-tool-result"
        },
        "full": {
          "exposure": "tool",
          "input_schema_ref": "schemas/qiongli_literature_search.full.input.schema.json",
          "output_schema_ref": "schemas/qiongli_literature_search.full.output.schema.json",
          "error_transport": "tool-result"
        }
      },
      "errors": [
        "invalid_arguments",
        "tool_error",
        "timeout"
      ],
      "side_effects": [
        {
          "class": "read",
          "mode": "always"
        },
        {
          "class": "network",
          "mode": "conditional",
          "trigger": "A schema-valid query is executed against one or more active literature providers."
        }
      ],
      "security": {
        "accepts_secret_input": false,
        "raw_secret_output": "forbidden",
        "redaction_required": true,
        "sensitive_output_paths": [],
        "profile_sensitive_output_paths": {
          "marketplace-lite": [
            "/search_plan",
            "/results",
            "/diagnostics"
          ],
          "full": [
            "/data",
            "/provenance"
          ]
        },
        "notes": [
          "Provider credentials and raw provider configuration values must not appear in results or errors.",
          "Full and Marketplace Lite intentionally retain profile-specific input and output schemas; the registry does not claim argument or result parity between them.",
          "Network access is bounded by active provider configuration and per-provider request limits."
        ]
      },
      "smoke_call_ids": [
        "lite.qiongli_literature_search.contract",
        "full.qiongli_literature_search.contract"
      ]
    },
    {
      "name": "qiongli_literature_export_evidence",
      "description": "Export an auditable provider capability, search plan, diagnostics, and result snapshot.",
      "aliases": [],
      "maturity": "preview",
      "lifecycle": {
        "introduced_in": "legacy",
        "deprecated_in": null,
        "remove_after": null
      },
      "profiles": {
        "skill-only": {
          "exposure": "metadata-only",
          "error_transport": "not-applicable"
        },
        "marketplace-lite": {
          "exposure": "tool",
          "input_schema_ref": "schemas/qiongli_literature_export_evidence.input.schema.json",
          "output_schema_ref": "schemas/qiongli_literature_export_evidence.output.schema.json",
          "error_transport": "json-rpc-and-tool-result"
        },
        "full": {
          "exposure": "tool",
          "input_schema_ref": "schemas/qiongli_literature_export_evidence.input.schema.json",
          "output_schema_ref": "schemas/qiongli_literature_export_evidence.output.schema.json",
          "error_transport": "tool-result"
        }
      },
      "errors": [
        "invalid_arguments",
        "tool_error"
      ],
      "side_effects": [],
      "security": {
        "accepts_secret_input": false,
        "raw_secret_output": "forbidden",
        "redaction_required": true,
        "sensitive_output_paths": [],
        "notes": [
          "Evidence export is side-effect free and must not add provider credentials to the snapshot."
        ]
      },
      "smoke_call_ids": [
        "lite.qiongli_literature_export_evidence.contract",
        "full.qiongli_literature_export_evidence.contract"
      ]
    },
    {
      "name": "qiongli_config_status",